{
  "$schema": "../../utils/game-info.schema.json",
  "gameCode": "D",
  "gameName": "duetos",
  "version": "1.1.87",
  "release": "stable",
  "releaseDate": "2023-11-05",
  "available": true,
  "title": {
    "pt": "Duetos",
    "en": "Duets"
  },
  "popularName": {
    "pt": "Dos pares",
    "en": "To pair things"
  },
  "inspiredBy": "souD",
  "summary": {
    "pt": "Faça pares com as cartas como os outros jogadores",
    "en": "Pair the cards like the other players"
  },
  "appearance": {
    "clouds": "socks-clouds",
    "cloudsAnimationType": "falling",
    "primaryColor": "#5891e0",
    "colorScheme": "light",
    "videoBackground": true
  },
  "rules": {
    "en": [
      "Let's pair stuff?",
      "Each round a collection of things will be shown to you and you have to make pairs!",
      "You get points equal to how many players made the same pair as you",
      "After 5 rounds, the player with the most points wins"
    ],
    "pt": [
      "Vamos parear as coisas?",
      "A cada rodada uma coleção de coisas será mostrada e você tem que fazer pares!",
      "Você ganha pontos iguais a quantos jogadores fizeram o mesmo par que você",
      "Depois de 5 rodadas, o jogador com mais pontos vence"
    ]
  },
  "duration": {
    "base": 20,
    "perPlayer": 1
  },
  "playerCount": {
    "best": 4,
    "recommended": [4, 5, 6],
    "min": 2,
    "max": 10
  },
  "tags": ["competitive", "pairing", "same-time", "achievements"],
  "options": [
    {
      "key": "nsfw",
      "kind": "switch",
      "label": "NSFW",
      "description": "Allow NSFW content",
      "values": [
        {
          "label": "Off",
          "value": false
        },
        {
          "label": "On",
          "value": true
        }
      ]
    },
    {
      "key": "withBots",
      "kind": "switch",
      "label": "Add Bots",
      "description": "Add bots to the game (for 2-3 player games only)",
      "disabled": true,
      "values": [
        {
          "label": "Off",
          "value": false
        },
        {
          "label": "On",
          "value": true
        }
      ]
    },
    {
      "key": "specialRounds",
      "kind": "checkbox",
      "label": "Special Rounds",
      "description": "Enable special rounds (Up to 3 special rounds will be used)",
      "values": [
        {
          "label": "Image Cards",
          "value": "images"
        },
        {
          "label": "Word",
          "value": "words"
        },
        {
          "label": "Celebrities",
          "value": "contenders"
        },
        {
          "label": "People/Suspects",
          "value": "suspects"
        },
        {
          "label": "Sprites (Emojis, Glyphs)",
          "value": "sprites"
        },
        {
          "label": "Avatars (Clubbers, Costumes, Super Heroes)",
          "value": "avatars"
        }
      ]
    }
  ]
}
