{
  "$schema": "../../utils/game-info.schema.json",
  "gameCode": "B",
  "gameName": "barrados-na-alfandega",
  "version": "0.0.5",
  "release": "planned",
  "releaseDate": "0000-00-00",
  "available": false,
  "title": {
    "pt": "Barrados Na Alfândega",
    "en": "Stuck On Customs"
  },
  "popularName": {
    "pt": "",
    "en": ""
  },
  "inspiredBy": "?????",
  "appearance": {
    "clouds": "cloud",
    "cloudsAnimationType": "flow",
    "primaryColor": "",
    "colorScheme": "light",
    "videoBackground": true
  },
  "summary": {
    "pt": "???",
    "en": "???"
  },
  "rules": {
    "pt": ["TBD"],
    "en": ["TBD"]
  },
  "playerCount": {
    "recommended": [3, 4, 5],
    "min": 3,
    "max": 6,
    "best": 0
  },
  "duration": {
    "base": 0,
    "perPlayer": 0
  },
  "tags": ["competitive"]
}
