{
  "$schema": "../../utils/game-info.schema.json",
  "gameCode": "I",
  "gameName": "idade-da-preda",
  "version": "0.9.24",
  "release": "beta",
  "releaseDate": "2025-06-08",
  "available": false,
  "title": {
    "pt": "Idade da Preda",
    "en": "Tongue Age"
  },
  "popularName": {
    "pt": "O de criar a linguagem",
    "en": "The one about creating language"
  },
  "inspiredBy": "aDaDaD",
  "summary": {
    "pt": "Homens das cavernas tem que criar uma nova língua. Vamos nomear objetos?",
    "en": "Cavemen must create a new language. Let's name objects?"
  },
  "appearance": {
    "clouds": "cave-painting-cloud",
    "cloudsAnimationType": "flow",
    "primaryColor": "#c1b629",
    "colorScheme": "dark",
    "videoBackground": true
  },
  "rules": {
    "pt": [
      "Somos homens (e mulheres) das cavernas que precisam criar uma nova língua",
      "No início de cada rodada, os jogadores criam conceitos a partir de coisas disponíveis na tela, por exemplo: 'bola' + 'elefante' + 'melancia' dão a ideia de redondo. Para cada conceito será atribuído uma sílaba/som",
      "Depois, os jogadores devem criar um nome para um de seus três objetos secretos usando pelo menos duas sílabas/sons/conceitos disponíveis",
      "E finalmente, é hora de adivinhar o que os jogadores nomearam fazendo pares entre coisas e nomes. Você ganha 2 pontos por cada acerto, e 1 ponto pra cada jogador que acertar o seu",
      "O jogo dura 5 rodadas, indo da época da pedra, ao mundo medieval, tempos modernos e até um futuro próximo."
    ],
    "en": [
      "We are cavemen who need to create a new language",
      "At the beginning of each round, players create concepts from things available on the screen, for example: 'ball' + 'elephant' + 'watermelon' gives the idea of round. Each concept will be assigned a syllable/sound",
      "Then, players must name one of their three objects using the available syllables/sounds/concepts, using at least two syllables",
      "Finally, it's time to guess what players named. You earn 2 points for each correct guess, and 1 point for each player who guesses yours",
      "The game lasts 5 rounds, going from the Stone Age to the medieval world, modern times, and even a near future."
    ]
  },
  "playerCount": {
    "recommended": [4, 5, 6],
    "best": 5,
    "min": 2,
    "max": 10
  },
  "duration": {
    "base": 0,
    "perPlayer": 0
  },
  "tags": ["cooperative", "competitive", "writing", "guessing"],
  "options": [
    {
      "key": "nsfw",
      "kind": "switch",
      "label": "NSFW",
      "description": "Allow NSFW content",
      "values": [
        {
          "label": "Off",
          "value": false
        },
        {
          "label": "On",
          "value": true
        }
      ]
    }
  ]
}
